{"$id": "https://do-math.invalid/schemas/cli/1/role-response", "$schema": "https://json-schema.org/draft/2020-12/schema", "additionalProperties": false, "properties": {"checkpoint": {"type": "string"}, "knowledge": {"items": {"additionalProperties": false, "properties": {"declaration_names": {"items": {"type": "string"}, "type": "array"}, "dependencies": {"items": {"type": "string"}, "type": "array"}, "explanation": {"type": "string"}, "kind": {"enum": ["conjecture", "definition", "definition_candidate", "observation", "obstacle", "partial_result", "proof_candidate", "question", "research_direction", "theorem"], "type": "string"}, "lean_code": {"type": "string"}, "statement": {"type": "string"}, "summary": {"type": "string"}, "title": {"type": "string"}}, "required": ["kind", "title", "statement", "explanation", "summary", "lean_code", "declaration_names", "dependencies"], "type": "object"}, "type": "array"}, "outcome": {"enum": ["submitted", "partial", "waiting", "no_result"], "type": "string"}, "questions": {"items": {"type": "string"}, "type": "array"}, "relations": {"items": {"additionalProperties": false, "properties": {"evidence": {"type": "string"}, "kind": {"type": "string"}, "source": {"type": "string"}, "target": {"type": "string"}}, "required": ["kind", "source", "target", "evidence"], "type": "object"}, "type": "array"}, "remaining_work": {"items": {"type": "string"}, "type": "array"}, "report": {"type": "string"}, "summary": {"type": "string"}, "used_sources": {"items": {"type": "string"}, "type": "array"}}, "required": ["summary", "used_sources", "questions", "outcome", "report", "knowledge", "relations", "remaining_work", "checkpoint"], "type": "object", "x-contract-id": "do-math-cli/1"}