{
  "checkpoint": "Parking.lean and explanation.md preserve the complete encoding, exact target, finite proof terms, exhaustive hand tables and declaration mapping. lean-preview.json records a successful preview on the exact source. Central formal checking and identity review remain pending. verification-notes.md preserves the earlier self-check rejection; a separate subsequent maximum-interval response was accepted.",
  "knowledge": [
    {
      "declaration_names": [
        "Parking.Preferences",
        "Parking.preferenceList",
        "Parking.firstSpace",
        "Parking.run",
        "Parking.park",
        "Parking.Success",
        "Parking.PF",
        "Parking.M",
        "Parking.b",
        "Parking.row",
        "Parking.UnimodalRow",
        "Parking.FullConjecture",
        "Parking.row_one",
        "Parking.row_two",
        "Parking.row_three",
        "Parking.success_trace",
        "Parking.failure_trace"
      ],
      "dependencies": [],
      "explanation": "Fix n:Nat. Preferences n is the type Fin n -> Fin n. Lean car i corresponds to charter car i+1; Lean preference or space j corresponds to charter value j+1. Consequently every labeled preference list occurs exactly once, with no quotient by permutations. Adding one to both preference and actual space preserves displacement.\n\nThe function preferenceList traverses car indices in increasing order. firstSpace scans List.range n in ascending order and finds the first s satisfying a<=s and absence from occupied. Thus it selects precisely the least vacant space weakly to the right of a, returning none if there is no eligible vacancy.\n\nThe recursive run processes the head preference before the tail. It first chooses s, inserts s into occupied, recursively processes the remaining preferences, and prepends s to the returned spaces. The output therefore retains arrival order. An unsuccessful choice or unsuccessful recursive tail makes the entire result none. The reverse storage order of occupied has no mathematical effect because only membership is tested. Induction on the preference list explains that a successful output has the same length as its input, all chosen spaces lie in range and weakly above their preferences, and no space is chosen twice. These general properties explain the operational definitions; separate general invariant theorems are not submitted here.\n\npark starts run from empty occupancy on a typed preference list. Success means park returns a present Option. PF n filters all functions Fin n -> Fin n by Success. M first obtains the successful space list and then folds maximum, starting at zero, over the differences in the arrival-order zip of spaces and preferences. On failure M is none. For n>=1 the successful lists are nonempty and all differences are nonnegative, so this fold is the charter's maximum displacement. At n=0 the empty successful list has M=some 0 by convention; FullConjecture excludes n=0.\n\nThe definition b(n,k) is the cardinality of the subset of PF n satisfying M=some k. Both the success filter and Option equality exclude failures. The definition row n lists b(n,0),...,b(n,n-1). For successful lists with n>=1, the operational bounds 0<=a<=s<n show that displacement lies between zero and n-1; thus this is the entire possible row. This explanation supplies the bound directly; no separate formal bound theorem is claimed.\n\nUnimodalRow n quantifies a peak c:Fin n. The increasing comparisons have k:Nat and k<c.val. The decreasing comparisons have c.val<=k and k+1<n. These are exactly the charter's ranges, including the possible final comparison k=n-2. For n=1 the unique peak is zero and both ranges are empty. FullConjecture is forall n:Nat, 1<=n -> UnimodalRow n. It is a proposition definition, not an assumed theorem.\n\nIndependent hand enumeration uses one-based strings for ordered lists. For n=1, the only list 1 parks at 1 with M=0, giving [1]. For n=2, 11 parks at 12 with M=1; 12 parks at 12 with M=0; 21 parks at 21 with M=0; 22 fails at car 2. Hence the row is [2,1].\n\nFor n=3 the following exhaustive enumeration lists preference -> actual spaces, followed by M, or the first failing car:\n111 -> 123, M=2;\n112 -> 123, M=1;\n113 -> 123, M=1;\n121 -> 123, M=2;\n122 -> 123, M=1;\n123 -> 123, M=0;\n131 -> 132, M=1;\n132 -> 132, M=0;\n133 -> failure at car 3;\n211 -> 213, M=2;\n212 -> 213, M=1;\n213 -> 213, M=0;\n221 -> 231, M=1;\n222 -> failure at car 3;\n223 -> failure at car 3;\n231 -> 231, M=0;\n232 -> failure at car 3;\n233 -> failure at car 3;\n311 -> 312, M=1;\n312 -> 312, M=0;\n313 -> failure at car 3;\n321 -> 321, M=0;\n322 -> failure at car 3;\n323 -> failure at car 3;\n331 -> failure at car 2;\n332 -> failure at car 2;\n333 -> failure at car 2.\nThe six M=0 lists are 123,132,213,231,312,321. The seven M=1 lists are 112,113,122,131,212,221,311. The three M=2 lists are 111,121,211. Thus there are 16 successes and 11 failures, giving [6,7,3]. These cases were followed by hand from the vacancy rule, independently of the Lean cardinality computation and without using another task's results or a general enumeration formula.\n\nEvery declaration is in namespace Parking. Preferences is the labeled preference type; preferenceList converts it to arrival order; firstSpace is least-vacancy selection; run is recursion with explicit initial occupancy; park starts from empty occupancy; Success tests complete success; PF is the finite set of successful lists; M is Option-valued maximum displacement; b is the exact count; row lists the entire displacement range; UnimodalRow defines the peak property; FullConjecture quantifies that property over n>=1. row_one, row_two, row_three prove the three complete rows. success_trace proves zero-based [1,0,0] parks as [1,0,2], corresponding to one-based 211 -> 213. failure_trace proves zero-based [2,2,0] fails, corresponding to one-based 331 and failure at car 2. The Decidable instance following Success supplies the computable predicate needed for filtering and introduces no mathematical assumption.\n\nThe three row proofs and two traces use by decide, constructing kernel-checkable proof terms by reduction of the definitions. There are no sorry terms, assumed count constants, native_decide calls or additional axioms. The supplied non-authoritative preview returned verified for all 17 declared names on Lean 4.32.0, commit 8c9756b28d64dab099da31a4c09229a9e6a2ef35, with empty stderr. PF and the definitions and proofs depending on its finite enumeration use only the permitted propext, Classical.choice and Quot.sound. The two trace proofs have no axiom dependencies. The actual feedback is retained in lean-preview.json. Central verification of the exact submitted source and independent comparison of this explanation with the declarations remain necessary. The finite checks establish no arbitrary-n unimodality conclusion.",
      "kind": "partial_result",
      "lean_code": "import Mathlib.Data.Fintype.Pi\nimport Mathlib.Data.List.OfFn\n\nnamespace Parking\n\n/-- Both cars and preferences use zero-based indices. -/\nabbrev Preferences (n : Nat) := Fin n → Fin n\n\ndef preferenceList {n : Nat} (a : Preferences n) : List Nat :=\n  List.ofFn (fun i => (a i).val)\n\n/-- Scan all spaces in increasing order, selecting the first eligible vacancy. -/\ndef firstSpace (n a : Nat) (occupied : List Nat) : Option Nat :=\n  (List.range n).find? (fun s => decide (a ≤ s) && !(occupied.contains s))\n\n/-- Return the actual spaces in arrival order; any failed car fails the run. -/\ndef run (n : Nat) : List Nat → List Nat → Option (List Nat)\n  | [], _ => some []\n  | a :: rest, occupied => do\n      let s ← firstSpace n a occupied\n      let tail ← run n rest (s :: occupied)\n      pure (s :: tail)\n\ndef park {n : Nat} (a : Preferences n) : Option (List Nat) :=\n  run n (preferenceList a) []\n\ndef Success {n : Nat} (a : Preferences n) : Prop := (park a).isSome = true\n\ninstance {n : Nat} (a : Preferences n) : Decidable (Success a) :=\n  inferInstanceAs (Decidable ((park a).isSome = true))\n\ndef PF (n : Nat) : Finset (Preferences n) :=\n  Finset.univ.filter (fun a => Success a)\n\n/-- M is absent on failure, and is the maximum displacement on success. -/\ndef M {n : Nat} (a : Preferences n) : Option Nat := do\n  let spaces ← park a\n  pure ((spaces.zip (preferenceList a)).foldl\n    (fun m pair => max m (pair.1 - pair.2)) 0)\n\ndef b (n k : Nat) : Nat :=\n  ((PF n).filter (fun a => M a = some k)).card\n\ndef row (n : Nat) : List Nat := List.ofFn (fun k : Fin n => b n k.val)\n\ndef UnimodalRow (n : Nat) : Prop :=\n  ∃ c : Fin n,\n    (∀ k : Nat, k < c.val → b n k ≤ b n (k + 1)) ∧\n    (∀ k : Nat, c.val ≤ k → k + 1 < n → b n k ≥ b n (k + 1))\n\ndef FullConjecture : Prop := ∀ n : Nat, 1 ≤ n → UnimodalRow n\n\ntheorem row_one : row 1 = [1] := by decide\ntheorem row_two : row 2 = [2, 1] := by decide\ntheorem row_three : row 3 = [6, 7, 3] := by decide\n\ntheorem success_trace : run 3 [1, 0, 0] [] = some [1, 0, 2] := by decide\ntheorem failure_trace : run 3 [2, 2, 0] [] = none := by decide\n\nend Parking\n",
      "statement": "For n>=1, Preferences n = Fin n -> Fin n encodes the charter's labeled preference lists by subtracting one from car labels, preferences and spaces. The recursive process chooses the least unoccupied space at or above each preference and returns none if any car fails. PF n contains exactly successful lists. M is absent on failure and otherwise records maximum displacement. The finite cardinality b(n,k) counts successful lists with M=some k. FullConjecture states that every n>=1 has a peak c:Fin n satisfying the charter's two weak adjacent-inequality ranges. The complete rows proved directly from these definitions for n=1,2,3 are [1], [2,1], [6,7,3]. No arbitrary-n unimodality theorem is asserted.",